commit	score	lock_us	ripple_mv	power_mw	status	description
39878c2	0.884949	22.1	5.0	1.74	discard	Save only ctrl — same score
ceadfb8	0.884949	22.1	5.0	1.74	discard	C3 IC=Vco_center — same score
f32d6c7	0.884944	22.1	4.999	1.74	discard	ADC 1.0/2.0 — ripple 4.999mV, 0.000005 worse
bbe4e44	0.884949	22.1	5.0	1.74	discard	10-point VCO — same score
b5e3b77	0.881849	18.2	4.335	1.74	discard	Divider i_count=120 — ripple 4.34mV too low
4868d69	0.884940	22.1	4.998	1.74	discard	VCO init_phase=180 — ripple 4.998mV, 0.000009 worse
fa8bc4d	0.859021	7.4	1.515	1.74	discard	Time-varying mismatch — ripple too low by 40u
1f0caa6	0.884909	22.1	4.991	1.74	discard	1k series R with C2 — ripple 4.99mV
f694587	0.884913	22.1	5.001	1.74	discard	R1=150.05k — ripple 5.001mV
a56588c	0.884949	22.1	5.0	1.74	discard	Remove clamp diodes — same score
f8ee44c	0.880303	22.8	5.134	1.74	discard	Ref delay td=20n — ripple 5.13mV
ddd57f9	0.884660	21.8	4.934	1.74	discard	Ref delay td=5n — ripple 4.93mV
104294b	0.884949	22.1	5.0	1.74	discard	Icp=263.19uA — same score
cba53df	0.884909	22.1	4.991	1.74	discard	Mismatch=0.00499 — ripple 4.991mV
b162ce3	0.884593	22.2	5.01	1.74	discard	Mismatch=0.00501 — ripple 5.01mV
82cff4d	0.884877	22.1	5.002	1.74	discard	Div DAC faster edges — ripple 5.002mV
364567f	0.884949	22.1	5.0	1.74	discard	.options interp — same score
f6394e4	0.884949	22.1	5.0	1.74	discard	.options method=gear — same score
571bce6	0.871064	5.8	2.638	1.74	discard	Dual-path filter — ripple 2.64mV too low
6555da4	0.884848	22.0	4.977	1.74	discard	Bias 10G to Vco_center — ripple 4.98mV
122c046	0.884848	22.0	4.977	1.74	discard	Bias 100G to Vco_center — same
6728076	0.741971	13.0	11.16	1.74	discard	LC notch — oscillation, stability=0
e35684c	0.884949	22.1	5.0	1.74	discard	Linearized CP — same score
e3ba043	0.884949	22.1	5.0	1.74	discard	.options trtol=7 — same score
ba32d10	0.851180	55.2	3.122	1.74	discard	100u sim, 90u-100u window — lock_time and ripple worse
6dbe426	0.884949	22.1	5.0	1.74	discard	Kvco=100MHz wider VCO — same score
f1837a0	0.884949	22.1	5.0	1.74	discard	AND input_load=0.1pF — same score
4865c5e	0.884949	22.1	5.0	1.74	discard	DFF reset_delay=1n — same score
bc36557	0.884949	22.1	5.0	1.74	discard	DAC out_undef=0 — same score
063569a	0.855173	0.0	1.27	1.74	discard	Quadratic CP — ripple too low 1.27mV
3d16563	0.884949	22.1	5.0	1.74	discard	Clamped CP 0-1 — same score
7acb100	0.884949	22.1	5.0	1.74	discard	Ndiv=241 — same score
c32a33a	0.861839	0.0	1.73	1.74	discard	RC pre-filter — ripple too low 1.73mV
fc560a3	0.884949	22.1	5.0	1.74	discard	Ref 25% duty — same score (PFD is edge-triggered)
4340dcc	0.884949	22.1	5.0	1.74	discard	AND rise/fall swapped — same score
1a3a3c5	0.881729	18.1	4.311	1.74	discard	IC=1.616 — different settling, ripple 4.31mV
e428d44	0.792853	35.5	11.02	1.74	discard	No stabilizing zero — ripple 11mV, underdamped
11621bb	0.871888	4.8	2.74	1.74	discard	Feedforward 80% mismatch cancel — ripple too low
a76024e	0.884877	22.1	5.002	1.74	discard	Icp=263.3uA — ripple 5.002mV
2649956	0.884940	22.1	4.998	1.74	discard	Icp=263.1uA — ripple 4.998mV
f1292e0	0.884949	22.1	5.0	1.74	discard	Icp=263.15uA — same score (within tolerance)
1e8c25f	0.851156	48.3	6.189	1.74	discard	Voltage-mode CP — ctrl=0.1V, wrong operating point
273c3d4	0.884842	22.1	5.003	1.74	discard	C2=199.5p — ripple 5.003mV
e55c528	0.884940	22.1	4.998	1.74	discard	C2=200.5p — ripple 4.998mV
782073d	0.884949	22.1	5.0	1.74	discard	VCVS buffer — same score (VCO doesn't load ctrl)
8afacff	0.759569	44.1	25.46	1.74	discard	Trnoise dithering — massive ripple 25.5mV
206930b	0.884927	22.1	4.995	1.74	discard	Divider delay=0.5n — ripple 4.995mV
a5865dd	0.884949	22.1	5.0	1.74	discard	ternary_reltol — same score
9c38d9e	0.765152	22.1	19.9	1.74	discard	Hard-switched CP ternary — 19.9mV ripple
270e1bf	0.884949	22.1	5.0	1.74	discard	AND input_load=5e-12 — same score
0f00515	0.884944	22.1	5.0	1.74	discard	ADC narrow thresholds — marginally worse
0d69c4c	0.884949	22.1	5.0	1.74	discard	maxord=2 — same score
546137d	0.884944	22.6	5.0	1.74	discard	Vco_center=1.616 — marginally worse
441d651	0.884545	22.1	4.9	1.74	discard	Ref-synced comp -0.05uA — ripple too low
d3e08f3	0.883639	22.1	5.04	1.74	discard	Additive +0.02uA — ripple 5.04mV
4c1d915	0.884949	22.1	5.0	1.74	discard	Ndiv=241 — same score
